{
  "$schema": "https://erdesigns.eu/schema/range-profile.json",
  "schema_version": 1,
  "type": "range-profile",
  "profile": "generic",
  "description": "Generic petrol/diesel-neutral OBD-II normal ranges for live and freeze-frame values.",
  "vehicle": "Generic OBD-II vehicle",
  "source": "generic workshop defaults",
  "ranges": [
    {
      "pid": "04",
      "key": "calculated_load",
      "caption": "Calculated load",
      "unit": "%",
      "min": 0,
      "max": 100,
      "low": 0,
      "high": 85,
      "default_low": 0,
      "default_high": 85,
      "alarm_margin": 0.5,
      "decimals": 0
    },
    {
      "pid": "05",
      "key": "coolant_temp",
      "caption": "Coolant temperature",
      "unit": "°C",
      "min": -40,
      "max": 130,
      "low": 70,
      "high": 105,
      "default_low": 70,
      "default_high": 105,
      "alarm_margin": 0.5,
      "decimals": 0
    },
    {
      "pid": "0B",
      "key": "intake_map",
      "caption": "Intake manifold absolute pressure",
      "unit": "kPa",
      "min": 0,
      "max": 300,
      "low": 90,
      "high": 230,
      "default_low": 90,
      "default_high": 230,
      "alarm_margin": 0.5,
      "decimals": 0
    },
    {
      "pid": "0C",
      "key": "engine_speed",
      "caption": "Engine speed",
      "unit": "rpm",
      "min": 0,
      "max": 8000,
      "low": 600,
      "high": 4500,
      "default_low": 600,
      "default_high": 4500,
      "alarm_margin": 0.5,
      "decimals": 0
    },
    {
      "pid": "0D",
      "key": "vehicle_speed",
      "caption": "Vehicle speed",
      "unit": "km/h",
      "min": 0,
      "max": 200,
      "low": 0,
      "high": 200,
      "default_low": 0,
      "default_high": 200,
      "alarm_margin": 0.5,
      "decimals": 0
    },
    {
      "pid": "0F",
      "key": "intake_air_temp",
      "caption": "Intake air temperature",
      "unit": "°C",
      "min": -40,
      "max": 80,
      "low": -20,
      "high": 50,
      "default_low": -20,
      "default_high": 50,
      "alarm_margin": 0.5,
      "decimals": 0
    },
    {
      "pid": "06",
      "key": "stft_b1",
      "caption": "Short-term fuel trim bank 1",
      "unit": "%",
      "min": -25,
      "max": 25,
      "low": -10,
      "high": 10,
      "default_low": -10,
      "default_high": 10,
      "alarm_margin": 0.5,
      "decimals": 1
    },
    {
      "pid": "07",
      "key": "ltft_b1",
      "caption": "Long-term fuel trim bank 1",
      "unit": "%",
      "min": -25,
      "max": 25,
      "low": -10,
      "high": 10,
      "default_low": -10,
      "default_high": 10,
      "alarm_margin": 0.5,
      "decimals": 1
    },
    {
      "pid": "10",
      "key": "maf",
      "caption": "Mass air flow",
      "unit": "g/s",
      "min": 0,
      "max": 250,
      "low": 2,
      "high": 200,
      "default_low": 2,
      "default_high": 200,
      "alarm_margin": 0.5,
      "decimals": 1
    },
    {
      "pid": "11",
      "key": "throttle_position",
      "caption": "Throttle position",
      "unit": "%",
      "min": 0,
      "max": 100,
      "low": 0,
      "high": 100,
      "default_low": 0,
      "default_high": 100,
      "alarm_margin": 0.5,
      "decimals": 0
    },
    {
      "pid": "2C",
      "key": "commanded_egr",
      "caption": "Commanded EGR",
      "unit": "%",
      "min": 0,
      "max": 100,
      "low": 0,
      "high": 60,
      "default_low": 0,
      "default_high": 60,
      "alarm_margin": 0.5,
      "decimals": 0
    },
    {
      "pid": "2D",
      "key": "egr_error",
      "caption": "EGR error",
      "unit": "%",
      "min": -50,
      "max": 50,
      "low": -10,
      "high": 10,
      "default_low": -10,
      "default_high": 10,
      "alarm_margin": 0.5,
      "decimals": 1
    },
    {
      "pid": "42",
      "key": "control_module_voltage",
      "caption": "Control module voltage",
      "unit": "V",
      "min": 10,
      "max": 16,
      "low": 12.2,
      "high": 14.8,
      "default_low": 12.2,
      "default_high": 14.8,
      "alarm_margin": 0.5,
      "decimals": 1
    },
    {
      "pid": "7A",
      "key": "dpf_dp",
      "caption": "DPF differential pressure",
      "unit": "kPa",
      "min": 0,
      "max": 30,
      "low": 0,
      "high": 12,
      "default_low": 0,
      "default_high": 12,
      "alarm_margin": 0.5,
      "decimals": 1,
      "notes": "Mode 01 PID $7A where supported; otherwise use the stable key."
    },
    {
      "pid": 0,
      "key": "boost_desired",
      "caption": "Boost desired pressure",
      "unit": "kPa",
      "min": 0,
      "max": 300,
      "low": 90,
      "high": 230,
      "default_low": 90,
      "default_high": 230,
      "alarm_margin": 0.5,
      "decimals": 0,
      "notes": "Profile key for non-standard/live-data sources without a Mode 01 PID."
    }
  ]
}
